<?xml version="1.0" encoding="utf-8"?>
<?xml version="1.0" encoding="UTF-8"?>
<xs:schema xmlns:xs="http://www.w3.org/2001/XMLSchema"
	targetNamespace="http://www.uniovi.es"
	xmlns="http://www.uniovi.es"
	elementFormDefault="qualified">

	<xs:element name="rutas">
		<xs:complexType>
			<xs:sequence>
				<xs:element minOccurs="3" maxOccurs="unbounded" ref="ruta" />
			</xs:sequence>
		</xs:complexType>
	</xs:element>
	<xs:element name="ruta">
		<xs:complexType>
			<xs:sequence>
				<xs:element ref="nombreRuta" />
				<xs:element ref="medioTransporte" />
				<xs:element ref="inicio" />
				<xs:element ref="duración" />
				<xs:element ref="agencia" />
				<xs:element ref="descripcion" />
				<xs:element ref="personasAdecuadas" />
				<xs:element ref="referencias" />
				<xs:element ref="recomendacion" />
				<xs:element ref="hitos" />
			</xs:sequence>
			<xs:attribute name="tipo" type="xs:string" use="required" />
		</xs:complexType>
	</xs:element>
	<xs:element name="nombreRuta" type="xs:string" />
	<xs:element name="medioTransporte" type="xs:string" />
	<xs:element name="inicio">
		<xs:complexType>
			<xs:sequence>
				<xs:element ref="fecha" />
				<xs:element ref="hora" />
				<xs:element ref="lugar" />
			</xs:sequence>
		</xs:complexType>
	</xs:element>
	<xs:element name="fecha" type="xs:date" />	
	<xs:element name="hora" type="xs:string" />
	<xs:element name="lugar">
		<xs:complexType>
			<xs:sequence>
				<xs:element ref="direccion" />
				<xs:element ref="coordenadas" />
			</xs:sequence>
			<xs:attribute name="nombre" type="xs:string" use="required" />
		</xs:complexType>
	</xs:element>
	<xs:element name="direccion" type="xs:string" />
	<xs:element name="coordenadas">
		<xs:complexType>
			<xs:sequence>
				<xs:element ref="longitud" />
				<xs:element ref="latitud" />
				<xs:element ref="altitud" />
			</xs:sequence>
			<xs:attribute name="tipo" type="tipo_Coordenadas" use="required" />
		</xs:complexType>
	</xs:element>
	<xs:element name="longitud" type="xs:float" />
	<xs:element name="latitud" type="xs:float" />
	<xs:element name="altitud" type="xs:float" />
	<xs:element name="duración" type="xs:duration" />
	<xs:element name="agencia" type="xs:string" />
	<xs:element name="descripcion" type="xs:string" />
	<xs:element name="personasAdecuadas" type="xs:string" />
	<xs:element name="referencias">
		<xs:complexType>
			<xs:sequence>
				<xs:element minOccurs="1" maxOccurs="3" ref="referencia" />
			</xs:sequence>
		</xs:complexType>
	</xs:element>
	<xs:element name="referencia" type="xs:string" />
	<xs:element name="recomendacion">
		<xs:simpleType>
			<xs:restriction base="xs:integer">
				<xs:minInclusive value="0" />
				<xs:maxInclusive value="10" />
			</xs:restriction>
		</xs:simpleType>
	</xs:element>
	<xs:element name="hitos">
		<xs:complexType>
			<xs:sequence>
				<xs:element minOccurs="3" maxOccurs="unbounded" ref="hito" />
			</xs:sequence>
		</xs:complexType>
	</xs:element>
	<xs:element name="hito">
		<xs:complexType>
			<xs:sequence>
				<xs:element ref="nombreHito" />
				<xs:element ref="descipcionHito" />
				<xs:element ref="coordenadas" />
				<xs:element ref="distancia" />
				<xs:element ref="fotos" />
				<xs:element ref="videos" />
			</xs:sequence>
		</xs:complexType>
	</xs:element>
	<xs:element name="nombreHito" type="xs:string" />
	<xs:element name="descipcionHito" type="xs:string" />
	<xs:element name="distancia">
		<xs:complexType>
			<xs:simpleContent>
				<xs:extension base="xs:float">
					<xs:attribute name="unidades" type="xs:string" use="required" />
				</xs:extension>
			</xs:simpleContent>
		</xs:complexType>
	</xs:element>
	<xs:element name="fotos">
		<xs:complexType>
			<xs:sequence>
				<xs:element minOccurs="1" maxOccurs="5" ref="foto" />
			</xs:sequence>
		</xs:complexType>
	</xs:element>
	<xs:element name="foto" type="xs:string" />
	<xs:element name="videos">
		<xs:complexType>
			<xs:sequence>
				<xs:element minOccurs="0" maxOccurs="3" ref="video" />
			</xs:sequence>
		</xs:complexType>
	</xs:element>
	<xs:element name="video" type="xs:string" />



	<xs:simpleType name="tipo_Coordenadas">
		<xs:restriction base="xs:string">
			<xs:enumeration value="origen"/>
			<xs:enumeration value="hito"/>
		</xs:restriction>
	</xs:simpleType>
</xs:schema>